[
  {
    "name": "Basico",
    "category": "Partnerwork Moves",
    "video": "",
    "translation": "Basic"
  },
  {
    "name": "Box Drill",
    "category": "Partnerwork Moves",
    "video": "",
    "translation": "Box Drill"
  },
  {
    "name": "Derecha",
    "category": "Partnerwork Moves",
    "video": "",
    "translation": "Right"
  },
  {
    "name": "Rhombo",
    "category": "Partnerwork Moves",
    "video": "",
    "translation": "Rhombus"
  },
  {
    "name": "Right Turn",
    "category": "Partnerwork Moves",
    "video": "",
    "translation": "Right Turn"
  },
  {
    "name": "Son",
    "category": "Partnerwork Moves",
    "video": "",
    "translation": "Son (Cuban Music Style)"
  }
]
